question,answer
what is organ donation,Organ donation is the process of donating healthy organs or tissues to save or improve another person's life.
what is organ transplantation,Organ transplantation is a surgical procedure where a donated organ is placed into a patient.
who can donate organs,Any healthy individual can become an organ donor after medical evaluation.
how can i become an organ donor,You can become an organ donor by registering at a government hospital or official organ donation portal.
how can i became a organ donor,You can become an organ donor by registering at a government hospital or official organ donation portal.
how do i become an organ donor,You can become an organ donor by registering at a government hospital or official organ donation portal.
how to register as an organ donor,You can register as an organ donor through hospitals or authorized organ donation websites.
where can i register for organ donation,You can register for organ donation at hospitals or government organ donation portals.
is organ donation legal in india,Yes organ donation is legal in India under the Transplantation of Human Organs Act.
what organs can be donated,Organs like kidneys liver heart lungs pancreas and tissues can be donated.
can a living person donate organs,Yes a living person can donate a kidney or part of the liver.
can a dead person donate organs,Yes organs can be donated after brain death with family consent.
what is brain death,Brain death is the irreversible loss of all brain functions.
who can receive donated organs,Patients with organ failure who are medically eligible can receive organs.
how does organ matching work,Organ matching is based on blood type tissue type medical urgency and waiting time.
what is the organ waiting list,The organ waiting list is a registry of patients waiting for organ transplants.
how long is the waiting period for organs,Waiting time depends on organ availability and patient condition.
is organ donation safe,Yes organ donation is medically safe when performed by professionals.
does organ donation cost money,No organ donation does not involve payment to the donor.
can family refuse organ donation,Yes family consent is required in most cases.
what is donor registration process,The donor registration process includes identity verification consent and medical evaluation.
what documents are needed for organ donation,Identity proof and consent forms are usually required.
can minors donate organs,Minors can donate organs only under special legal and medical conditions.
can women donate organs,Yes women can donate organs if medically fit.
can elderly people donate organs,Age is not a barrier if organs are healthy.
what is living donor,Living donor is a person who donates an organ while alive.
what is deceased donor,A deceased donor is someone who donates organs after death.
what is organ donation consent,Consent is legal permission given for organ donation.
is organ donation ethical,Yes organ donation is ethical and lifesaving.
can organs be donated after accident,Yes organs can be donated after brain death caused by accidents.
how many organs can one person donate,One donor can save up to eight lives through organ donation.
what is tissue donation,Tissue donation includes cornea skin bone and heart valves.
can eyes be donated after death,Yes eyes can be donated within hours after death.
how to donate eyes,Contact an eye bank immediately after death.
what is organ allocation system,It is a system that fairly distributes donated organs.
can foreigners donate organs in india,Foreigners can donate organs under Indian transplant laws.
what is transplant surgery,Transplant surgery places a donated organ into a patient.
what happens after organ donation surgery,Donors recover under medical supervision.
what are risks of organ donation,Risks are minimal and explained before donation.
is organ donation confidential,Yes donor information is kept confidential.
what is organ donation awareness,It promotes knowledge and acceptance of organ donation.
can organs be donated to anyone,Organs are allocated based on medical priority.
what is cross organ donation,Cross donation involves donor recipient matching swaps.
can blood group affect organ donation,Yes blood group compatibility is required.
can diabetic donate organs,Diabetics may donate organs depending on medical evaluation.
how organ donation saves lives,Organ donation gives patients a second chance at life.
